{
  "properties": {
    "device_name": {
      "type": "string",
      "title": "Device Name"
    },
    "device_type": {
      "type": "string",
      "title": "Device Type"
    },
    "version": {
      "type": "string",
      "title": "Version"
    },
    "manufacturer": {
      "type": "string",
      "title": "Manufacturer"
    },
    "manufacture_date": {
      "type": "string",
      "title": "Manufacture Date"
    },
    "ce_mark": {
      "type": "string",
      "title": "Ce Mark"
    },
    "unique_device_identifier": {
      "type": "string",
      "title": "Unique Device Identifier"
    },
    "eifu": {
      "type": "string",
      "title": "Eifu"
    },
    "warning": {
      "anyOf": [
        {
          "type": "string"
        },
        {
          "type": "null"
        }
      ],
      "title": "Warning"
    },
    "support": {
      "anyOf": [
        {
          "type": "string"
        },
        {
          "type": "null"
        }
      ],
      "title": "Support"
    },
    "uk_responsible_person": {
      "anyOf": [
        {
          "type": "string"
        },
        {
          "type": "null"
        }
      ],
      "title": "Uk Responsible Person"
    }
  },
  "type": "object",
  "required": [
    "device_name",
    "device_type",
    "version",
    "manufacturer",
    "manufacture_date",
    "ce_mark",
    "unique_device_identifier",
    "eifu"
  ],
  "title": "MedicalDeviceLabel",
  "$schema": "https://json-schema.org/draft/2020-12/schema",
  "$id": "https://api.autoderm.ai/schemas/MedicalDeviceLabel.json"
}